{
  "schema_version": "1.0.0",
  "task_id": "fool-tier-material-saint-v1",
  "revision": 1,
  "kind": "hierarchy",
  "mode": "concept",
  "quality": {"sequence": 4, "visual_tier": "saint"},
  "output": {"aspect": [1, 1], "background": "opaque"},
  "prompt": "Use case: stylized-concept. Asset type: reusable SAINT quality material reference for the Fool pathway frame and EmblemDock, not a finished card and not a new geometry. Primary request: a square close material study using secret blue #4D97D4 as the main anchor on cool silver metal and smoky-violet recessed enamel, with sacred-grade depth, crisp but restrained relief, controlled blue-violet hue movement, and a precise faceted diamond with luminous internal refraction. The elevation is communicated by material authority, depth and light discipline, never by adding ornaments. Text (verbatim): none. Constraints: preserve the existing family of surfaces; no frame silhouette, no emblem, no mask, no numeral, no Chinese characters, no name, no character, no scene, no extra ornaments, no crown, no wings, no additional gemstones, no global tint, no rainbow noise, no watermark. Agentic study only; deterministic material masks own final pixels.",
  "references": [{"path": "artifacts/production/fool-five-tier-direct-kit-v1/frame-saint-native.png", "sha256": "f63a7cec39eaace60c5441dba9df69b9de592b575b9cdb7c14486e8bf92709db", "role": "style"}],
  "limits": {"max_attempts": 1},
  "spec": {"tier": "saint", "geometry": "沿用冻结母版位置，只研究秘蓝圣者材质与宝石光学，不改变几何。", "clear_regions": [[0, 0, 1000, 1500]]},
  "contracts": [
    {"path": "docs/production-sop-v3.md", "sha256": "8684d96a3ca0163d556f97ea884cc5a3337aa8edebc357cb95ce21dfa3e04838"},
    {"path": "config/quality-color-tokens.json", "sha256": "de81e5912a02968232d609622636d29e1ca35da42c095221071174678beb74fa"}
  ]
}
