{
  "schema_version": "1.0.0",
  "revision": 1,
  "references": [
    {
      "path": "artifacts/production/klein-carrier-geometry-v1/reference.png",
      "sha256": "362c48b70e5242619ae1f0535686f4378833915078d79267189020ed71f988a0",
      "role": "style"
    }
  ],
  "limits": {
    "max_attempts": 2
  },
  "task_id": "klein-seer-subject",
  "kind": "subject",
  "mode": "production",
  "output": {
    "aspect": [
      1,
      1
    ],
    "background": "opaque"
  },
  "prompt": "Use case: illustration-story. Generate a SINGLE exquisite square painterly illustration, NOT a card layout. The attached empty card is ONLY a palette and craft reference; do not draw its frame, emblem, nameplate or any lettering. Subject: Klein Moretti from Lord of Mysteries, during his Tingen Sequence 9 Seer period: young adult man, black hair, deep brown eyes, ordinary believable features with scholarly character and thoughtful restrained warmth, no beard, no monocle. He sits at a small polished wooden table in a quiet Victorian divination club, body in three-quarter view. He uses HIS ANATOMICAL LEFT HAND (on viewer right) to hold a delicate silver chain with one clear honey-yellow citrine pendulum suspended almost touching a cup of dark red tea. Left hand, continuous chain, citrine, tea surface form the one clear main visual event. His other hand rests naturally beside an opened study book with no legible writing. He watches the pendulum attentively, not the viewer. Hands exactly anatomically plausible, one pendant, one cup; the chain is taut and delicately curved only as gravity permits, no magical levitation. The pendulum is subtly angled to imply a small movement, not an energy beam. Elegant near-waist-up portrait, visible entire head and both hands, face in upper-middle, cup and pendulum in lower-middle, keep all these inside central 75 percent with comfortable margins for a rounded square crop. White high collar, charcoal wool waistcoat and dark formal coat, period plausible, no modern jewelry. Soft warm light from upper left models the face and hands; deep smoke-violet and muted brown shadow, faint cool dusk from a distant bay window, background bibliographic shelves softly receding. Intimate human scale, extremely beautiful classical oil-painting craft, realistic character acting, no anime, no plastic CGI. NO throne, tentacles, puppet strings, cosmic fog, magical circles, high-level powers, luminous eyes, extra people, potion bottle, invented ritual, text, letters, numbers, frame or insignia. Paint an integrated interior scene; outer margins quieter and darker, not a cutout portrait.",
  "spec": {
    "slot_id": "lotm.fool.s09",
    "card_id": "lotm.fool.s09.klein-moretti.tingen-01",
    "character_id": "klein-moretti",
    "event": "克莱恩左手持银链黄水晶，在茶杯上方做灵摆占卜。",
    "semantic_source": "pathways/fool/sequences/09/card.json",
    "protagonist": {
      "kind": "character",
      "name_zh": "克莱恩·莫雷蒂",
      "name_status": "verified",
      "evidence_refs": [
        {
          "path": "pathways/fool/canon.json",
          "sha256": "a756a915a69496b882fc69b9ca766bd53693eb98fb5e30fef8b577a5d46f334d"
        }
      ]
    }
  }
}
