{
  "schema_version": "1.0.0",
  "revision": 1,
  "task_id": "fool-s09-card-name-edit-v1",
  "kind": "subject",
  "mode": "production",
  "quality": {
    "sequence": 9,
    "visual_tier": "low"
  },
  "output": {
    "aspect": [
      2,
      3
    ],
    "background": "opaque"
  },
  "references": [
    {
      "path": "artifacts/production/fool-s09-card-agentic-v1/v001/agentic-full-card-candidate-v1.png",
      "sha256": "e20c0a0164ffeaba825242e09891f4ab394d697e0488101fe97ae0870d200c72",
      "role": "edit_target"
    }
  ],
  "narrative": {
    "path": "production/narratives/klein-s09-tingen.json",
    "sha256": "35e063ac3bc082e3ba6db43492beabb632896f4875a10e66104ad4d574b72d81"
  },
  "contracts": [
    {
      "path": "production/symbols/fool-five-tier-kit.json",
      "sha256": "27a4cbe9b443c3cb23798e4532559b36b883c783517ed40888f6728479e3764a"
    },
    {
      "path": "production/symbols/fool-agentic-sequence-inscriptions-v2.json",
      "sha256": "2d3143a737ba386706d60848affaca9caff11ca9373b96f7c4cee401f073e6df"
    },
    {
      "path": "production/templates/fool-mother-frame-interface-v1.json",
      "sha256": "a6285639e2299c8a22b75395b338134e7c25efbb986a0501a2723bc0664a9908"
    },
    {
      "path": "production/templates/emblem-dock-interface-v1.json",
      "sha256": "9a95288d8b7f5df2287c43f9667ea656c0e8cf8272bf2da5cbb87d218e7f088b"
    },
    {
      "path": ".agents/skills/lotm-quality-frames/SKILL.md",
      "sha256": "6f82603b49e57b53b5e99804fec7c9217b60748cee364e5deac57b24b327a9b8"
    },
    {
      "path": ".agents/skills/lotm-subject/SKILL.md",
      "sha256": "e40670e8024b79f6f93c82d7beb067f0db124c97c3a41e6072d321ddcb67357f"
    },
    {
      "path": "docs/production-sop-v3.md",
      "sha256": "8684d96a3ca0163d556f97ea884cc5a3337aa8edebc357cb95ce21dfa3e04838"
    },
    {
      "path": "docs/production-preflight.md",
      "sha256": "7660ebe23b09d1b35c5956338e6af6a1bc843c758bb8d0858b6c0e159ec32ac4"
    },
    {
      "path": "config/production-resolution-policy.json",
      "sha256": "502d6af735052ce3f9f9743cadb92573949d8f75b0ea717cdf9bf2317c48e382"
    },
    {
      "path": "docs/card-narrative-contract.md",
      "sha256": "3c38a490a72d59b702d8c6dfe184dd8224a7fe6c77e9a800045f8ce7219dea88"
    }
  ],
  "limits": {
    "max_attempts": 2
  },
  "spec": {
    "slot_id": "lotm.fool.s09",
    "card_id": "lotm.fool.s09.klein-moretti.tingen-01",
    "character_id": "klein-moretti",
    "event": "克莱恩以左手持银链黄水晶，在红茶上方进行灵摆占卜。",
    "semantic_source": "pathways/fool/sequences/09/card.json",
    "protagonist": {
      "kind": "character",
      "name_zh": "克莱恩·莫雷蒂",
      "name_status": "verified",
      "evidence_refs": [
        {
          "path": "pathways/fool/canon.json",
          "sha256": "a7fc2fb3c1bbb7a752bf500451147e07518e557c81389304790b2a0ae285bf6a"
        }
      ]
    }
  },
  "prompt": "Use case: precise-object-edit. Asset type: current Fool pathway Sequence 9 complete native card candidate. Input image 1 is the edit target and the only visual source. Primary request: add the exact artistic Chinese name inscription \"克莱恩·莫雷蒂\" inside the existing bottom name surface only. Invariants: preserve entire card pixel-for-pixel in every other region: upright 2:3, silver-white low-tier frame, smoky-violet inlays, top Fool crown, circular rank dock and numeral 9, left 愚者, right 占卜家, all stars/ornaments, bottom equilateral-hexagonal silver-white diamond, continuous Tingen divination scene, face, hands, pendulum, cup, book, lighting/material. Name: exact six Chinese characters/punctuation as one elegant engraved/embossed display inscription, horizontally/vertically centered by actual strokes within existing bottom name surface, large/readable, refined silver-white relief/subtle highlight; no plaque/replacement background/opaque rectangle/duplicate text/mirror/pseudo-writing/additional labels/watermark. One complete upright native 2:3 card, not crop/layer."
}
