{
  "schema_version": "1.0.0",
  "task_id": "fool-quality-frame-low-v2",
  "revision": 1,
  "kind": "hierarchy",
  "mode": "concept",
  "quality": {"sequence": 9, "visual_tier": "low"},
  "output": {"aspect": [2, 3], "background": "transparent"},
  "prompt": "Use case: precise-object-edit. Create ONE empty Fool pathway card frame as a restrained LOW quality material study. Use the attached frozen geometry master as the only silhouette authority. Preserve the existing slender U-shaped frame, double folded-curtain side rails, fixed wide nameplate, one bottom quality diamond, exact front orthographic 2:3 composition, outer margin, and the large open top emblem safe region. Material direction: primary configured color #E8EDF2 silver-white, expressed as matte mist silver on the frame texture, pale cool recessed enamel, and a quiet silver-white diamond with a tiny cold highlight; retain only the existing smoky-violet recessed Fool identity channels. Quality is conveyed by restrained matte optical response and low contrast, never by adding parts. STRICT ZERO-DRIFT INVARIANTS: do not move, resize, rotate, redraw or reinterpret the outer silhouette, illustration window, nameplate, diamond, curtain folds, anchor centers or top opening. Do not add or remove any ornament. No top crossbar, socket, halo, crown, wings, pendants or extra gems. No text, digit, emblem, mask, character or scene. Keep every empty region genuinely transparent, including the top opening, illustration window and outside edges; no checkerboard pixels, backdrop, fog, cast shadow or global tint. Return one centered complete frame only.",
  "references": [
    {"path": "artifacts/production/fool-five-tier-direct-kit-v1/frame-low-native.png", "sha256": "14c8707f23c6e295c4b0c7ec25ee5cd7b11f028d7ccda09656baccf3166e8783", "role": "edit_target"},
    {"path": "artifacts/production/fool-fusion-9/v002/raw.png", "sha256": "ff797f0b7dfea42067fd07ab564835c484fa66cd7b470d41cac25a512fab0144", "role": "style"}
  ],
  "limits": {"max_attempts": 2},
  "spec": {
    "tier": "low",
    "geometry": "统一锁定的纤细U形愚者骨架；两侧双帷幕折槽；固定姓名牌与单一底部品质嵌片；顶部大范围留空；品质只由材质与光学响应表达。",
    "clear_regions": [[220, 30, 560, 375], [140, 450, 720, 795]]
  },
  "contracts": [
    {"path": "docs/production-preflight.md", "sha256": "7660ebe23b09d1b35c5956338e6af6a1bc843c758bb8d0858b6c0e159ec32ac4"},
    {"path": "production/symbols/quality-frame-five-tier-direction.json", "sha256": "09a716dfeff6a4fa37a35dde2ee1b2cfdee09da83254ac3ba6163e8ca34c1ec4"},
    {"path": "production/symbols/quality-geometry-lock.json", "sha256": "d3ef137a33a7af1276f71f4690559ef6f998886712ca545a8509ef0d70f48969"},
    {"path": "config/quality-color-tokens.json", "sha256": "33c9be1107fbceb92ba37de4b98eef67ba4b7eb5adb8e18855f1be434fe169a6"},
    {"path": "config/sequence-hierarchy.json", "sha256": "a1498455569c2c1d2bd38379fa0e12cc00eed10de337a43b031bff60cc4489ae"},
    {"path": "production/symbols/fool-kit-matte.json", "sha256": "b3d0519d04ca2fed036a2e7d2b39c1b9a2ae4c62752cdfc5bd1b8a0ee9bb0daa"}
  ]
}
