{
  "schema_version": "1.0.0",
  "task_id": "sigil-fool",
  "revision": 1,
  "kind": "foundation",
  "mode": "concept",
  "output": {
    "aspect": [
      1,
      1
    ],
    "background": "transparent"
  },
  "prompt": "Use case: stylized-concept. Asset type: ONE standalone collectible occult pathway emblem, precision jewelry-grade relief artwork for a card asset library. Original artistic interpretation for the 愚者 / fool pathway, NOT a copied official religious emblem. Primary design: An exquisitely carved asymmetric theatrical half-mask cradled by two flowing folded curtains; an opening of mysterious empty space behind the mask; curtain folds and mask edges join as ONE openwork crest. Smoky violet enamel, antique pale gold, mist silver. Broad mask silhouette, no clock, no doorway. Craftsmanship: museum-quality micro-chased metal, layered pierced openwork, satin recesses contrasting polished bevels, restrained precious inlays; rich sculptural depth and genuinely exquisite detail, NOT a flat vector outline or generic app icon. One coherent primary symbol with a bold readable silhouette, not a pile of objects. Straight-on orthographic view, whole emblem centered occupying about 78% of a SQUARE canvas, generous clean margin. Soft upper-left studio illumination; no ground plane or cast shadow outside the object. GENUINELY TRANSPARENT background, including all internal openwork holes; no black rectangle, no white rectangle, no checkerboard pixels. No text, letters, digits, watermark, card border, human portrait or surrounding scene.",
  "references": [],
  "limits": {
    "max_attempts": 2
  },
  "spec": {
    "material": "An exquisitely carved asymmetric theatrical half-mask cradled by two flowing folded curtains; an opening of mysterious empty space behind the mask; curtain folds and mask edges join as ONE openwork crest. Smoky violet enamel, antique pale gold, mist silver. Broad mask silhouette, no clock, no doorway.",
    "lighting": "柔和左上光，精雕浮雕自阴影，无背景投影",
    "tiling": false,
    "use_scope": [
      "emblem:fool",
      "reusable-pathway-identity"
    ]
  }
}
